{
    "data_type": "image",
    "description": "cifar10 training images, 32x32, rgb",
    "format_version": "0.2.0",
    "url": "https://www.cs.toronto.edu/~kriz/cifar.html",
    "image_data": {
        "sources": [
            {
                "directory": "cifar10/train/airplane",
                "label": 0
            },
            {
                "directory": "cifar10/train/automobile",
                "label": 1
            },
            {
                "directory": "cifar10/train/bird",
                "label": 2
            },
            {
                "directory": "cifar10/train/cat",
                "label": 3
            },
            {
                "directory": "cifar10/train/deer",
                "label": 4
            },
            {
                "directory": "cifar10/train/dog",
                "label": 5
            },
            {
                "directory": "cifar10/train/frog",
                "label": 6
            },
            {
                "directory": "cifar10/train/horse",
                "label": 7
            },
            {
                "directory": "cifar10/train/ship",
                "label": 8
            },
            {
                "directory": "cifar10/train/truck",
                "label": 9
            }
        ],
        "task_type": "classification"
    },
    "label_names": {
        "0": "airplane",
        "1": "automobile",
        "2": "bird",
        "3": "cat",
        "4": "deer",
        "5": "dog",
        "6": "frog",
        "7": "horse",
        "8": "ship",
        "9": "truck"
    },
    "num_model_classes": 10,
    "sampling": {
        "algorithm": "none",
        "arguments": {}
    },
    "timestamp": "2020-11-06T08:18:00"
}