{
    "data_type": "image",
    "description": "Juneberry metadata files created using detectron2 text detection validation set.",
    "format_version": "0.2.0",
    "url": "https://cocodataset.org/#download",
    "image_data": {
        "sources": [
            {
                "directory": "detectron2-text-detection/val/coco_annotations.json"
            }
        ],
        "task_type": "object_detection"
    },
    "label_names": {
        "0": "HINDI",
        "1": "ENGLISH",
        "2": "OTHER"
    },
    "num_model_classes": 3,
    "sampling": {
        "algorithm": "none",
        "arguments": {}
    },
    "timestamp": "2021-03-05T10:00:00"
}